{
  "$schema": "https://json-schema.org/draft/2020-12/schema",
  "$id": "https://tinywin.dev/schemas/entry.schema.json",
  "title": "TinyWin Entry",
  "type": "object",
  "additionalProperties": false,
  "required": [
    "schemaVersion",
    "id",
    "version",
    "title",
    "description",
    "category",
    "risk",
    "handler",
    "phase",
    "parameters"
  ],
  "properties": {
    "schemaVersion": {
      "const": 1
    },
    "id": {
      "type": "string",
      "pattern": "^[a-z0-9]+(?:[.-][a-z0-9]+)*$"
    },
    "version": {
      "type": "string",
      "pattern": "^[0-9]+\\.[0-9]+\\.[0-9]+$"
    },
    "title": {
      "type": "string",
      "minLength": 1
    },
    "description": {
      "type": "string",
      "minLength": 1
    },
    "category": {
      "type": "string",
      "minLength": 1
    },
    "risk": {
      "enum": ["Low", "Medium", "High"]
    },
    "selectionTier": {
      "enum": ["Standard", "Expert", "Experimental"]
    },
    "handler": {
      "type": "string",
      "pattern": "^[A-Za-z]+(?:\\.[A-Za-z]+)+$"
    },
    "phase": {
      "const": "MountedImage"
    },
    "parameters": {
      "type": "object"
    },
    "requires": {
      "type": "array",
      "items": {
        "type": "string",
        "pattern": "^[a-z0-9]+(?:[.-][a-z0-9]+)*$"
      },
      "uniqueItems": true
    },
    "conflicts": {
      "type": "array",
      "items": {
        "type": "string",
        "pattern": "^[a-z0-9]+(?:[.-][a-z0-9]+)*$"
      },
      "uniqueItems": true
    }
  }
}
