{
  "schemaVersion": 1,
  "id": "registry.disable-iscsi-initiator",
  "version": "1.0.0",
  "title": "禁用 iSCSI Initiator",
  "description": "禁用 Microsoft iSCSI Initiator 服务；连接 iSCSI SAN 或远程块存储将不可用。",
  "category": "Storage",
  "risk": "High",
  "selectionTier": "Expert",
  "handler": "Registry.DisableOfflineService",
  "phase": "MountedImage",
  "parameters": {
    "services": ["MSiSCSI"]
  }
}
