{
  "schemaVersion": 1,
  "id": "appx.remove-people",
  "version": "1.0.0",
  "title": "移除 People",
  "description": "移除 Microsoft People 预装 Appx。",
  "category": "Applications",
  "risk": "Low",
  "handler": "Appx.RemoveProvisioned",
  "phase": "MountedImage",
  "parameters": { "patterns": ["Microsoft.People"] }
}
