{
  "schemaVersion": 1,
  "id": "appx.remove-feedback-hub",
  "version": "1.0.0",
  "title": "移除反馈中心",
  "description": "移除 Windows Feedback Hub 预装 Appx。",
  "category": "Applications",
  "risk": "Medium",
  "handler": "Appx.RemoveProvisioned",
  "phase": "MountedImage",
  "parameters": { "patterns": ["Microsoft.WindowsFeedbackHub"] }
}
