{
  "schemaVersion": 1,
  "id": "registry.disable-smart-card",
  "version": "1.0.0",
  "title": "禁用智能卡服务",
  "description": "禁用 Smart Card 服务及设备枚举服务；智能卡登录、证书读取器和部分企业身份验证设备将不可用。",
  "category": "Security",
  "risk": "High",
  "selectionTier": "Expert",
  "handler": "Registry.DisableOfflineService",
  "phase": "MountedImage",
  "parameters": {
    "services": ["SCardSvr", "ScDeviceEnum"]
  }
}
