{
  "schemaVersion": 1,
  "id": "driverstore.remove-fibre-channel-drivers",
  "version": "1.0.0",
  "title": "移除 Fibre Channel 与 FCoE 驱动",
  "description": "从 Driver Store 移除 Emulex、Marvell、QLogic 和 Broadcom Fibre Channel/FCoE 驱动。连接相应 SAN 或 HBA 时设备将不可用。",
  "category": "Drivers",
  "risk": "High",
  "handler": "DriverStore.RemoveInbox",
  "phase": "MountedImage",
  "parameters": {
    "infNames": [
      "elxfcoe.inf",
      "elxstor.inf",
      "bxfcoe.inf",
      "qefcoe.inf",
      "ql2300.inf",
      "ql40xx2i.inf",
      "qlfcoei.inf",
      "bfad.inf",
      "bfadfcoe.inf",
      "bxois.inf",
      "qeois.inf"
    ]
  }
}
