{
  "schemaVersion": 1,
  "id": "dism.remove-network-policy-server",
  "version": "1.0.0",
  "title": "移除 Network Policy Server",
  "description": "移除 NPS/RADIUS 服务器及管理工具；网络访问策略、RADIUS 身份验证和记账将不可用。",
  "category": "Server Roles",
  "risk": "High",
  "selectionTier": "Expert",
  "handler": "Dism.RemoveOptionalComponent",
  "phase": "MountedImage",
  "parameters": {
    "features": ["NPAS-Role", "NPSManagementTools", "NPSMMC"],
    "removePayload": true
  }
}
